{
  "id": 623268060,
  "name": "能量",
  "canonicalId": 1318854283,
  "baseClasses": [
    {
      "id": 1472482346,
      "power": 2
    },
    {
      "id": 470275444,
      "power": 1
    },
    {
      "id": 845944798,
      "power": -2
    }
  ],
  "uomList": [
    {
      "id": 1318854283,
      "name": "焦耳",
      "uomClassId": 623268060,
      "abbreviation": "J",
      "factor": 1.0,
      "offset": 0.0,
      "origin": "SystemDefined"
    },
    {
      "id": 717922917,
      "name": "吉瓦时",
      "uomClassId": 623268060,
      "abbreviation": "GWh",
      "factor": 3600000000000.0,
      "offset": 0.0,
      "refUomId": 1318854283,
      "refFactor": 3600000000000.0,
      "refOffset": 0.0,
      "origin": "SystemDefined"
    },
    {
      "id": 186555004,
      "name": "兆瓦时",
      "uomClassId": 623268060,
      "abbreviation": "MWh",
      "factor": 3600000000.0,
      "offset": 0.0,
      "refUomId": 1318854283,
      "refFactor": 3600000000.0,
      "refOffset": 0.0,
      "origin": "SystemDefined"
    },
    {
      "id": 885559585,
      "name": "瓦时",
      "uomClassId": 623268060,
      "abbreviation": "Wh",
      "factor": 3600.0,
      "offset": 0.0,
      "refUomId": 1318854283,
      "refFactor": 3600.0,
      "refOffset": 0.0,
      "origin": "SystemDefined"
    },
    {
      "id": 1559877794,
      "name": "英热单位",
      "uomClassId": 623268060,
      "abbreviation": "Btu",
      "factor": 1055.05585262,
      "offset": 0.0,
      "refUomId": 1318854283,
      "refFactor": 1055.05585262,
      "refOffset": 0.0,
      "origin": "SystemDefined"
    },
    {
      "id": 1368774577,
      "name": "卡路里",
      "uomClassId": 623268060,
      "abbreviation": "cal",
      "factor": 4.1868,
      "offset": 0.0,
      "refUomId": 1318854283,
      "refFactor": 4.1868,
      "refOffset": 0.0,
      "origin": "SystemDefined"
    },
    {
      "id": 189770482,
      "name": "吉焦",
      "uomClassId": 623268060,
      "abbreviation": "GJ",
      "factor": 1000000000.0,
      "offset": 0.0,
      "refUomId": 1318854283,
      "refFactor": 1000000000.0,
      "refOffset": 0.0,
      "origin": "SystemDefined"
    },
    {
      "id": 1940648592,
      "name": "千焦",
      "uomClassId": 623268060,
      "abbreviation": "kJ",
      "factor": 1000.0,
      "offset": 0.0,
      "refUomId": 1318854283,
      "refFactor": 1000.0,
      "refOffset": 0.0,
      "origin": "SystemDefined"
    },
    {
      "id": 718247581,
      "name": "千瓦时",
      "uomClassId": 623268060,
      "abbreviation": "kWh",
      "factor": 3600000.0,
      "offset": 0.0,
      "refUomId": 1318854283,
      "refFactor": 3600000.0,
      "refOffset": 0.0,
      "origin": "SystemDefined"
    },
    {
      "id": 1167425844,
      "name": "兆焦",
      "uomClassId": 623268060,
      "abbreviation": "MJ",
      "factor": 1000000.0,
      "offset": 0.0,
      "refUomId": 1318854283,
      "refFactor": 1000000.0,
      "refOffset": 0.0,
      "origin": "SystemDefined"
    },
    {
      "id": 752066640,
      "name": "瓦秒",
      "uomClassId": 623268060,
      "abbreviation": "Ws",
      "factor": 1.0,
      "offset": 0.0,
      "refUomId": 1318854283,
      "refFactor": 1.0,
      "refOffset": 0.0,
      "origin": "SystemDefined"
    },
    {
      "id": 310490055,
      "name": "千卡",
      "uomClassId": 623268060,
      "abbreviation": "kcal",
      "factor": 4186.8,
      "offset": 0.0,
      "refUomId": 1368774577,
      "refFactor": 1000.0,
      "refOffset": 0.0,
      "origin": "SystemDefined"
    },
    {
      "id": 1377444084,
      "name": "百万卡路里",
      "uomClassId": 623268060,
      "abbreviation": "Mcal",
      "factor": 4186800.0,
      "offset": 0.0,
      "refUomId": 1368774577,
      "refFactor": 1000000.0,
      "refOffset": 0.0,
      "origin": "SystemDefined"
    },
    {
      "id": 253655028,
      "name": "百万英热单位",
      "uomClassId": 623268060,
      "abbreviation": "MMBtu",
      "factor": 1055055852.62,
      "offset": 0.0,
      "refUomId": 1559877794,
      "refFactor": 1000000.0,
      "refOffset": 0.0,
      "origin": "SystemDefined"
    }
  ]
}