{
  "id" : 398067309,
  "name" : "Specific Volume",
  "canonicalId" : 71077421,
  "baseClasses" : [ {
    "id" : 1472482346,
    "power" : 3
  }, {
    "id" : 470275444,
    "power" : -1
  } ],
  "uomList" : [ {
    "id" : 71077421,
    "name" : "cubic meter per kilogram",
    "uomClassId" : 398067309,
    "abbreviation" : "m³/kg",
    "factor" : 1.0,
    "offset" : 0.0,
    "origin" : "SystemDefined"
  }, {
    "id" : 1294206910,
    "name" : "cubic foot per pound",
    "uomClassId" : 398067309,
    "abbreviation" : "ft³/lb",
    "factor" : 0.0624279605761446,
    "offset" : 0.0,
    "refUomId" : 71077421,
    "refFactor" : 0.0624279605761446,
    "refOffset" : 0.0,
    "origin" : "SystemDefined"
  }, {
    "id" : 2128487548,
    "name" : "cubic centimeter per gram",
    "uomClassId" : 398067309,
    "abbreviation" : "cm³/g",
    "factor" : 0.001,
    "offset" : 0.0,
    "refUomId" : 71077421,
    "refFactor" : 0.001,
    "refOffset" : 0.0,
    "origin" : "SystemDefined"
  } ]
}